post_id,title,content,like_count,category,keyword
31,6月16日 伍尔夫《海浪》最治愈的生命独白 	 在疲惫的时候，偏爱读伍尔夫的《海浪》。 	 没有跌宕的剧情，只有散落的、温柔的瞬间，治愈所有紧绷的情绪。 	 这段奈维尔的独白，是全书最明亮的一笔，彻底打破了秋日的萧瑟与意识流的清冷。 	 “一片叶子落下，是出于欢喜。 远方的钟声悠悠响起，不为告别死亡， 只为热烈、鲜活的生命而鸣。” 	 寻常的河畔光景，灼热日光、斑驳树影、缓缓漂流的小船， 	 在细腻的感知里，变成了独属于生命的盛大浪漫。 	 我们总习惯赋予落叶凋零、钟声别离的悲凉寓意， 	 可伍尔夫借文字告诉我们：万物的起落，皆是生命自在的舒展。 	 真正的热爱生活，从不是奔赴遥远的永恒， 	 而是珍惜每一个「当下存在」的瞬间。 	 沉浸微风、光影、人间烟火， 	 接纳当下的美好，热烈拥抱鲜活的自己， 	 这就是生命最好的状态✨ 	 #伍尔夫 #海浪 #伍尔夫语录 #意识流文学 #文学摘抄 #治愈文案 #生命美学 #伍尔夫日书 #每日英语 #英语原著阅读 - 小红书,6月16日 伍尔夫《海浪》最治愈的生命独白 	 在疲惫的时候，偏爱读伍尔夫的《海浪》。 	 没有跌宕的剧情，只有散落的、温柔的瞬间，治愈所有紧绷的情绪。 	 这段奈维尔的独白，是全书最明亮的一笔，彻底打破了秋日的萧瑟与意识流的清冷。 	 “一片叶子落下，是出于欢喜。 远方的钟声悠悠响起，不为告别死亡， 只为热烈、鲜活的生命而鸣。” 	 寻常的河畔光景，灼热日光、斑驳树影、缓缓漂流的小船， 	 在细腻的感知里，变成了独属于生命的盛大浪漫。 	 我们总习惯赋予落叶凋零、钟声别离的悲凉寓意， 	 可伍尔夫借文字告诉我们：万物的起落，皆是生命自在的舒展。 	 真正的热爱生活，从不是奔赴遥远的永恒， 	 而是珍惜每一个「当下存在」的瞬间。 	 沉浸微风、光影、人间烟火， 	 接纳当下的美好，热烈拥抱鲜活的自己， 	 这就是生命最好的状态✨ 	 #伍尔夫 #海浪 #伍尔夫语录 #意识流文学 #文学摘抄 #治愈文案 #生命美学 #伍尔夫日书 #每日英语 #英语原著阅读,20,情感故事,治愈文案
32,韩国文学温馨疗愈的句子… - 小红书,首尔青坡洞有一家叫Always的便利店，它always商品短缺、always人手不足，被街坊邻居吐槽是“蕞不便利的便利店” 	 可就是这样一家“不便”的小店，却成了无数失意者的落脚地： 	 失忆流浪汉独孤，从流落街头到成为夜班店员，笨拙却真诚，用一碗热饭团、一杯玉米须茶，悄悄接住每个崩溃的人； 	 毕业即失业、焦虑到神经衰弱的“首漂”，在便利店的烟火气里，慢慢找回前行的勇气； 	 生意濒临倒闭、却固执不肯做外卖的烤肉店老板，在几句唠叨的开导中，解开了心结； 	 叛逆又孤独的高中生，在这里找到了逃离压抑家庭的小小角落，重拾对生活的热爱… 	 作者金浩然的笔触很细腻，喜欢看《请回答1988》或者《深夜食堂》的小宝们，建议你们去看这本《不便的便利店》！！ 	 ps：每次看到美食描写的时候我特别希望自己旁边有一份炸鸡🍗...书摘图片我放在下面！ 	 #infp #书摘 #金句 #文学 #韩国文学 #治愈 #情感共鸣 #阅读马拉松 #惊艳到你的句子 #我会被文字打动,692,情感故事,治愈文案
33,一些充满能量的句子3.0✨ - 小红书,最后，应该向前，继续向前 我期待这个春天。 #我被文字打动 #文字的力量 #句子分享 #自我成长 #高能量 #有力量的话 #磁场 #治愈 #infj,4784,情感故事,治愈文案
34,生命感 淡淡 文案 - 小红书,#生命与自然 #文案 #温柔系治愈文案 #infj的世界 #治愈文案 #忧郁感 #生命力 #分享文案 #文案分享,1985,情感故事,治愈文案
35,更大的世界会稀释痛苦，也会稀释爱。 - 小红书,原作者：@梁州 	 多年前的夏天，在大树下第一次听见蝉鸣时喜悦的时刻，已然是上个世纪的回望了。更大的世界会稀释痛苦，也会稀释爱。 	 #阅读 #女性成长 #分享 #明亮的夜晚#知识 #生命的意义在于感受 #那份具象的爱 #慢慢理解世界 #这个世界会好的 #爱我缓慢向上的勇气,24498,情感故事,治愈文案
36,‧₊˚柔软细腻の全肯定文案 - 小红书,៷>ᴗ<៷谢谢饱饱们的点赞收藏 爱你们🫶🏻 	 1.眼泪和坚持一样伟大 	 2.可以脆弱 可以是不完美的 	 3.你在的话 下雨也是一种好天气 	 4.如果有人否定你 那我加倍肯定你 	 5.你的心是一团棉花 你落泪它就会变得湿重窒息 你要多笑一笑 像晴天把它晒蓬松 	 6.我看见你 我相信你 我理解你 我支持你 我爱你 	 7.你就是一个很好很好的人啊 遇见你我真的很幸福 	 8.你是全世界最棒的小孩 我希望你如明媚的骄阳 散发着自信与光芒 不要像阴天里没晒好的小被子 潮湿而沉闷 	 9.允许自己熬夜 允许自己把衣服在椅子上堆成小山 允许自己连续听一首歌五十遍 允许自己原谅一个人之后又倒戈 允许一直想念 允许没有交集 允许一切发生 	 10.你偏爱自由那就祝你远走高飞 你想要风光无限那就祝你得偿所愿 倘若你想两全其美 我也觉得没有问题 你本就该如此圆满 	 11.生命没有那么多意义 祝你生动 祝你有1万次闪耀和哭泣 祝你是你 	 12.不和任何人比较 永远站在自己这边 下定决心做一个幸福主义者 #文案素材分享 #今日份文案分享 #温柔系治愈文案 #温柔小众文案 #小众高级文案,1128,情感故事,治愈文案
37,我要稳稳的幸福 - 小红书,自存一些有生命力和幸福感的文案！！#我要稳稳的幸福 #做坚定的幸福主义者 #愿我们都能站在幸福里 #文案馆 #文案分享 #文案,10159,情感故事,治愈文案
38,一些幸福的meme🍀 - 小红书,我喜欢淡淡的生活 淡淡的情绪 淡淡的心情和简略的语言 就像雨滴落在地面没有任何痕迹 我喜欢这样平静的生活 淡淡的就会减少很多的痛苦 淡淡的就顺顺的 #韩语meme#幸福#幸运#分享图片#淡淡的幸福,1387,情感故事,治愈文案
39,李娟真的太会写了，这段看得我泪流满面😭 - 小红书,我不得安宁。 无论生活在多么偏远僻静的地方， 我的心都不得安宁。 我最嘈杂，最贪婪。 我与眼下这世界格格不入。 眼下世界里，青草顶天而生， 爬虫昼追日，夜逐月。 风是透明的河流，雨是冰凉的流星。 只有我最简陋，最局促。 我酝酿出一份巨大的悲哀， 却流不出几行眼泪。 我全面坦露自己的软弱， 捶胸顿足，小丑般无理取闹。 可万物充耳不闻。 我无数遍讲诉自己的孤独， 又讲诉千万人的万种孤独。 越讲越尴尬，独自站在地球上，无法收场。 ——李娟《遥远的向日葵地》 #读书 #情感 #孤独 #美文#文学 #书籍#李娟 #治愈书单 #好句摘抄分享 #遥远的向日葵地#我被文字感动了 #文学的力量 #infj #治愈系散文,20905,情感故事,治愈文案
40,好喜欢这一句话 - 小红书,- 晒透、吸饱这世界的丰盛。 Bask to the full and soak up the abundance of the world. - “晒透、吸饱这世界的丰盛。被感召着越走越远，直至我的小径没入黑暗。” 我想，固执的迈入这生命，然后，追着光，迎着风，热烈肆意的走一遭，活一次，最后滚烫着离开，就是我们来到这个世界的意义吧。 - #大大方方做自己 #我会被文字打动 #文字的力量 #每日分享 #中英双语 #读书 #文案 #治愈 #成长 #Allin我自己,627,情感故事,治愈文案
1,雨季不再来,没有任何词句能比“雨季不再来”更好的形容我每次回顾青春往事时的心情。 	 生命中曾奉为圭臬的沉默、不能开解的结、和自以为天长地久的隐痛居然都随着雨季的结束消失殆尽。曾折磨我不得安睡的理想和恐惧如今成了我生命中平静的湖泊。我依旧追寻它们，却不再迷恋。 	 在偶尔的书写和表达以及更长时间的沉默中，会梦见高中时的人和事。我最想逃离的自己，你如今过得还好吗？ 	 原来一切就像我曾写过的那样，在没有生长痛的夜晚，人才能品味到青春的回甘。 —— 亲爱的echo，感谢你写下《雨季不再来》 	 #随笔 #原创随笔 #我会被文字打动 #青春 #girlstalk #爱是 #三毛 #icity #漫长的雨季 #回忆,7077,情感故事,青春随笔
2,她是我十七岁左胸口的一拓淤青。,写一点青橘味的、爱与伤痛辨不分明的高中时代，两个女孩子的故事。 - “如果你看我的电影/听我爱的CD/如果你能带我一起旅行。” “如果你会开始相信/这般恋爱心情/如果你能给我如果的事。” ——范玮琪/张韶涵《如果的事》 - 看向她的时候发现她也正看向我，眼睛黑白分明，专注得仿佛整个世界里只有我的身影。对视了几秒后，我们不由自主地笑起来。于是我的心动和无措被很好地掩饰，在很久很久之后我想起它们，它们才会被这样定义。而她是我十七岁左胸口上的一拓淤青，只有我走出了那些季节，才会意识到自己止步不前的种种，承认自己不够坦诚的内心，以及离开她后我后知后觉的疼痛——但我也同时知道，是她让我见到了与过去全然不同的四季，让我开始相信，旷远的岁月里永远存在一个名为爱的支点。 最后的最后，手机屏幕亮起，弹出的是她的回复。 她说。好，那就冬天见。 	 #短篇 #文章 #原创 #原创随笔 #小说 #我会被文字打动 #碎碎念 #青春 #INFJ,19766,情感故事,青春随笔
3,《苦橙子》｜致每个女孩失声的青春期,“当语言失效时，身体便开始尖叫” 这篇文字写起来很痛苦，但我希望大家都能自己治愈自己，咽下苦橙子，用声音代替咳嗽， 让那些“未发出的声音”都可以被听到#原创随笔 #原创短篇小说#青春期 #谁的青春不迷茫  #girltalk #软柿子疯起来,4618,情感故事,青春随笔
4,“与我在世界的角落渺小又清晰地共振”,二十岁，洋流与季风会将我们的二十岁吹彻至哪座城市。你在晚自习课间曾与我提起的明亮未来，我们抵达了吗。还有那时曾以为不可逾越的重山万壑，时过境迁后再回看，我们会不会喟叹自己当下的热烈与勇敢。而如果那时也是一个雨汽未歇的秋夜，落叶还未纷飞不绝，我们坐在长椅上共同拆阅这封信，在你看到这里的时候，我会重新与你提起关于爱、自由、恳切，和你说其实永远并不遥远，它的起始日期是许多年前的这个夏天。 	 #原创 #随笔 #情感文案 #祝福文案 #青春 #浪漫生活的记录者 #夏天 #约稿展示请勿使用  #infj #infp,1202,情感故事,青春随笔
5,只是那时，歇斯底里的声音覆盖住了意义,只是那时，歇斯底里的声音覆盖住了意义。 	 学生时代是喧豗而轰然的。响了很久的上课铃在老师的谩骂声中渐渐消失，我们只能用笔尖反复摩挲着纸面来转移注意力。苦口婆心的教诲听了无数遍，却还是选择在大道理面前沉默，陷入无边的题海。 	 晚自习时，各个班级里的英语听力交错播放。教室里的灯光明晃晃的，与窗外的夜幕截然不同。车水马龙在耳边萦回，鸣笛声不断，成为一种属于晚自习的背景音。每每此刻，我总是会在心里默默想着：可不可以，把我，连同我的梦想一起带走？ 	 白昼里那些被埋藏的情绪，被淹没的委屈，在此刻也纷纷复活。我们开始在心里喋喋不休，有些话欲言又止，化为眼泪掉落。 	 但那是自由也有迹可循。夜阑人静时，走廊里依旧人满为患，昏黄的灯光将梦想的影子拖得好长好长。我们总是高谈阔论着，未来与以后，岁月与流年，总觉得多年后听起来也像是弹指之间。 却忘了，此时此刻，愿景与如今重叠的瞬间，才是最伟大的永远。 	 我们歇斯底里，总在故事的最后，才明白苦海的波澜起伏。 	 #Icelume #文字 #随笔 #我们永远在这里 #学生时代 #青春 #爱 #苦海 #学海无涯苦作舟 #那时的我们不懂永远,476,情感故事,青春随笔
6,命运，某天我也想将你轻描淡写,十三岁，我拥有一颗感伤的心脏，为命运多舛而叹气 	 命运，某天我也想将你轻描淡写。存放在日记本里，像一滴泪缓缓划过脸颊。可是，你偏偏在痛苦而孤独的周折里，与我纠缠不清，从纸页的文字里洇开，化作连绵的雨季，打湿了为幸福封存的留白。于是，痛苦拥抱了我，成为十三岁的底色 	 痛苦的气息越来越清晰，幸福的脚步便越来越急促 	 漫长的十三岁里，为什么幸福总是短暂？随着成长一并而来的是沉重心事，填满了生命的纹理，透支了鲜活的期待。藏不住的心事生长为一棵树，停驻在我的心脏，扎得很深很深。在泪水的雨季里，树杈延向了小小的天，遮得密不透风。我开始感受不到世界的喧嚣，只剩下安静的痛苦 	 我的十三岁和雨有一个共同点，青涩而仓促 	 我试图用敏感的心感知这个世界，代替迟顿的感官。然而然而，世界对我太清晰。清晰到难以承受幸福的分量，只剩下丰盈的痛苦，慢慢涌入心脏的那片干涸地，充沛成一片苦涩的海 	 我的痛，我的泪，我的伤被欲言又止，如鲠在喉。十三岁的我沉默着接下一切，只为幸福降临时稳稳落地，长久拥有 	 于是，我不再哭泣，幸福像雨下个不停 	 #命运 #随笔 #原创随笔 #上热门 #寄秋戏雾 图源于@Lethe 最近可能会多次重发,22962,情感故事,青春随笔
7,人类最不擅长的事是说再见,人类最不擅长的事是说再见。 	 “再见”这个字真的好神奇。它太轻了，像是从口齿之间轻飘飘地叹出来的，飞到未知的远方。它又太重了，落在似水年华里，像一滴积攒已久的泪珠坠落到轻薄的纸上，晕开的是我们的百感交集。又像是重若千钧的陨石毫无征兆地降落在土地上，留下难以填平的沟壑。 	 “再见”说出口时，周围的空气仿佛都染上了悲情的色彩。我感受到，江海在吐纳，世界在叹息，宇宙在无情地吸吮着时间。 	 我想，再见这个词，大抵也有很悠久的历史吧。它囊括了太多太多，跨越了王朝的更迭和四季的变迁，从光年之外走向我们眼前，见证着我们从一开始的犹豫不决到后来的落子无悔。 	 毕业典礼那天，很多事情被带上了“最后一次”的前缀。最后一张合照，最后一次拥抱，最后一次和你说再见，最正式、最有温度的再见。我看着你眼睛里的我自己变得越来越小，看着你的背影，默默地说出了道别的话语。 随后迎来的，是泪眼婆娑。 	 “再见”这个词，早已穿透了我们生命的涟漪，穿梭在跌宕起伏之间。 	 我们该说再见，还是再也不见呢？ 	 #文字 #随笔 #我们还会再见的 #人总要离别 #Icelume #爱 #青春 #再见 #离别 #所以说永远多长,5148,情感故事,青春随笔
8,“人生是一场巨大的后知后觉”,其实那次，和她的蕞后一面，我是没想到的。分别的时候，她站在车站的台阶前，还同我道：“不要不记得我，不管以后见不见得了，你都要开心。” 	 那时我笑着说：“怎么可能！”可时光过境，她的声音越来越逼真地盘旋在心底，这是我后知后觉才听见的诺言，以及那个少女模糊的回响。 这样的告别在每个夜晚都更清晰，潜入旧梦，潜入雨夜。过去的声音像一台老旧的收音机，断断续续地播着回忆。只不过，等到信号清晰时，那些当时觉得微不足道的瞬间，早已成了刺痛心尖的遗憾。 #原来我们就是青春 #治愈 #成长 #情感 #原创随笔 #约稿展示 #命运的子弹正中眉心 #校园 #人总是要长大 #文字 @校园薯 @小红书创作助手,2052,情感故事,青春随笔
9,“趁夏日未完结 趁我们还深信不疑明天”,像行过雨水满溢的节气却只持一柄单薄旧伞，过往的刻痕遗留下湿漉漉的脉络，拂不尽的水汽如同年复一年困住我的嶙峋山峦。 我依旧被反复困在那座山。 	 #原创 #随笔 #情感 #文案 #文字的力量 #青春 #遗憾 #毕业 #浪漫生活的记录者 #infj,1095,情感故事,青春随笔
10,天地霏雨  人与人 藕断丝连,#文字 #随笔 #原创 #情感共鸣 #inmyfeelings #fyp #青春 #intp#情感树洞,228,情感故事,青春随笔
11,“成长是偷走夏天的小偷”,我也以为夏天会慢慢变好的，树木会更葱郁，阳光会更干净，风声和雨声清晰又动听，直到岁月从我眼前奔走而过，年少时亲手设计构筑的夏天彻底崩塌，烟尘四起。我没有呜咽，没有嚎啕，也没有歇斯底里。直至此刻，我已经变得平静、柔顺，也终于确信：成长是偷走夏天的小偷，所有盛大的幻想终究是难以敌过时间和现实的刀刃。 	 时间从十八岁碾过、撕扯过，留下了很多细密的疼。夏天是闷热的、潮湿的，蝉鸣是吵嚷的，我停止了一切幻想，接受了夏天只是夏天的真相。 	 夏天，只是一个季节。 	 #夏天 #成长 #遗憾,2315,情感故事,青春随笔
12,“夏天适合畅想明亮”,我们不要辜负长夏，不要辜负白昼和晴天。 	 #随笔 #夏天 #成长 #高校诗歌创作联盟 #信件 #肆意地感受夏夭 #友谊地久天长,362,情感故事,青春随笔
13,期末复习总让人有灵感,复习的时候，打游戏，会心慌，放下手柄，觉得时光虚度。但写东西不会，像是回到高中晚自习对着草稿纸发呆的时候，特别满足。 #随笔 #期末复习#记录#bg#薄荷,5404,情感故事,青春随笔
14,我从何时开始爱你,去谈论开始喜欢一个人时间是件很困难的事情。 从这端遥遥地望向开始那端，一种近视的模糊，本能的话语缺失。很难找到开始的那个的端点，汹涌的爱意来临之前也不会有任何体感上的征兆，蚂蚁不会在马路上搬家。 所谓喜欢，更像是在乌鸦喝水，每一个心动的时刻是一颗石子，一颗一颗投进去。当水位终于上升到满溢，水流顺着杯壁作流泪状汩汩留下，才心下轰然，觉察那是爱。 	 #文字 #我被文字打动 #爱情 #暗恋 #爱永远是突然降临的 #原创,7713,情感故事,青春随笔
15,“我的青春是朴素的”,#云序言 #淼嘉恋专属话题 #随笔 #青春是一本仓促的书 #这就是青春 #那是我再也回不去的青春 #青春是那么美好 #我的青春落幕了 #青春是一场盛夏 #我的青春回头看了我一眼,21811,情感故事,青春随笔
16,我们无法预知某一瞬间的价值直到它成为回忆,"- 	 看了余华的节目，他谈到青春，真是让我又哭又笑。 	 在余华看来，人的记忆是有选择性的，青春也是可以自己定义的，只要让你愿意记住的，就是青春的起点。 	 他心里的青春，从27岁发表小说开始。27岁以前天天给人拔牙的那段人生他无法称之为""青春""。年轻时他也曾怀揣成为歌唱家的梦想，每天凌晨到海边练声，反倒被村里人误以为山中闹👻，只得狼狈放弃。 	 可他说，正是那些不切实际的梦想，才让青春显得生机勃勃。倘若每个梦想都很实际，那就不叫梦想了。 	 余华也有青春的遗憾。有次搬家时嫌书信麻烦，烧掉了一大箱的信件，其中有十多封史铁生的信。那部分珍贵的记忆没有了，这长久的懊悔，成了他回忆里特殊的一段。 	 - 	 关于青春，40岁的仁科认为，此时此刻便是一个人的青春；精 选 创作者特厨隋坡坦言，自己没有上过高中，十八岁误打误撞进入后厨，选择在烟火炉灶里开启了人生篇章。 	 他们的青春都没有被年龄所框住。 	 所以《一个文学的午后》让我想明白了：不必纠结年少碌碌无为，也不用困在过往的缺憾里内耗。我们可以筛选记忆，和灰暗的过往和解、放下糟糕的从前。 	 人生没有迟到的青春，每一个奔赴热爱的当下，都能成为青春崭新的起点。 	 #余华 #一个文学的午后 #青春 #青春回忆 #人生感悟 #文字的力量 #2026高考季 #高考前最后叮嘱",164,情感故事,青春随笔
17,“我们都被困在了十七岁的走廊里”,那时候，总觉得生活太难，可现在想来，被安排、被催促、被明确“该做什么、不该做什么”的时候，竟然是一种奢望的幸福。 他们说高考之后，一切都会好起来。可入了大学后，当不同口音在宿舍碰撞，当五湖四海的生活习惯大相径庭，我才发现，高中时的秩序感，早已是一种不可复刻的温柔。 大学或者工作后，没有人关心你坐在了哪里，没有人检查你听懂了哪一部分的课，没有人耳提面命告诉你“期末考这些重点”，更没有人追着你喊“功课写完了就该睡觉”。 一切都断开了，就像你和父母见面的频率从“每天”变 成了“按月”，和朋友们的久别从周末，变成了一年。 我们变成了大人。 大到再也找不到那种无需试探就能并肩的默契。我们梦里的操场，能重现的，只是高中，无解的数学题，白杨树的绿浪，还有那些操场上无数次顺时针绕行的步伐。 那一刻我明白了，我们无法同时拥有青春，以及对它的感受。 #原来我们就是青春 #成长 #治愈 #回到十七岁 #原创随笔 #情感 #校园 #那是我再也回不去的青春 #我无比庆幸此刻年少 #年少时的我们 #小红书游学团 #生活荣誉博士 #生活走读生 #约稿,15312,情感故事,青春随笔
18,然夏天仍是夏天,青春十纪的故事似乎总聚焦于具体的夏天，朦胧又清晰。夏天是自由蓬勃，像被人抱着转圈一样热烈，生命力疯长。夏天是漫出泡沫的啤酒，是吹来满足的海风，是散步偶遇的浪漫，当然耳机里还得放着summertime的live版。 	 我浸泡在初夏，却对将至的热夏没有半点期待。我对夏天最真实的记忆是无尽的雨季，深蓝色气旋压得人喘不过气来。柏油马路的沥青味，潮湿的霉味，阴沟反臭，人海中的肉夹气，恐怕五点早起的小鸟闻了都想吐，蚊子闻了都吸不动血。或许因为在深冬出生，夏天总让我感到烦闷，粘稠，难以扎根。流不完的汗与泪，意识被烈阳晒成空白，想法在炽热中收窄。我像闯入家中的蜜蜂，一次次撞在生硬的玻璃上，窗户似铁丝网般将我包围。而且似乎夏天一过我就得长大，然而夏天难以走出，死结未解，新生未临，在一双双眼睛下，艰涩又尴尬。 	 三岛说，“夏天”这个词本身就使人联想到“死”和“糜烂”。晚夏明丽的霞光，也含着糜烂的火红。我只奢求在这样的季节能活得流利一点，能躲在凌霄花后，永远“不要被命运找到”。 #文字 #感想 #热门 #夏天 #讨厌夏天,1949,情感故事,青春随笔
19,“我觉得二十二岁是最擅长告别的年纪”,人生的归属感不过是暂时的寄托，能与谁共鸣、能在何处安放自我，都需要一点点放下执念的勇气。 成长好像是一座飘在风中的客栈，总有人暂住、有人远行，樶后只剩下自己，和并不算沉重的影子。这个年纪里，很难拥有稳定深度的关系，大家都像是候鸟，下一个停靠点尚未可知，也许前一刻还热络相谈，后一刻就各奔东西。久而久之，我们学会在告别中成长。 我相信，生活本身即是一场场有始无终的迁徙。不同的机场，不同的安检口。我的生活在大地的经纬间不断转场，从熟悉到陌生、从欢笑到沉默、从相逢到分离。提着行李箱穿梭在航站楼之间，手机里存着零零散散的道别短信，去往新的目的地，却总有一些难舍的过往被遗落于原点。@热点薯 @小红书创作助手 #治愈 #成长 #原创随笔 #毕业总是会有遗憾的 #青春的遗憾 #随笔 #青春是一本仓促的书 #文字 #那就好好道别 #原来我们就是青春,245,情感故事,青春随笔
20,走进明亮且永恒的夏天,亲爱的朋友 人生不乏可爱且美妙的日子 希望你顺利到达要去的地方 到了以后幸福美满 #随笔 #原创 #成为更好的自己 #做自己#浪漫生活的记录者 #人到底能感受多少回夏天 #所有美好都发生在夏天 #做自己 #黎时希 #人生是旷野,854,情感故事,青春随笔
