post_id,title,content,like_count,category,keyword
21,“泪水其实很伟大”,#文字 #随笔 #原创 #备忘录文字 	 年少时，你视泪为卑怯的标签。每一滴清泪沿着咽喉往下沉，坠进胸腔，坠进心脉，一滴，两滴，千千万万滴——它们在那里汇聚成一片不见天日的暗湖。那片湖没有名字，没有声音，甚至没有来处，它们只是沉默地存在着，日日夜夜替你承受着无法言语的重量。 直到沉睡的泪水苏醒。你开始毫无征兆地哭。听歌时猝不及防的共鸣，看故事时感同身受的悲戚，与人交心时猝然涌上的酸涩，都成了泪水倾泻的契机。哭过之后，身体会变得很轻。那些堵在心口的、咽在喉咙里的、说不清道不明的郁结，被泪水一点一点化开，顺着脸颊滑落，落地蒸发。 世人总说哭泣无用，可泪水的伟大，不在于改变世事，而在于接纳所有不堪，拥抱残缺的自己。让你终于不必再伪装坚强，不必再为哭泣感到羞耻。每一次落泪，都是在把那些年流进心里的泪水，一滴一滴地悉数归还。 所以我想，我会一直哭。 直到泪水裹挟所有苦楚奔流，心底再无阴霾。 直到泪水流过的地方，生出柔软的脉络，赋予我新的勇气。,14084,情感故事,青春随笔
22,“这些，才是被称作青春的东西”,等你们长大后，回想起高中这三年，你们根本不会记得自己学到了什么，只会想起一些停电的夜晚，食堂某天做得特别好吃的红烧肉，还有全班同学一起看过的影片，这就是后来被你们称作青春的东西。 ps.上面是网传小说里的一段话。 #原来我们就是青春 #2025高考季 #高考应援团 #成长 #原创随笔 #治愈 #情感 #高中 #校园 #约稿展示 @校园薯,3439,情感故事,青春随笔
23,“如果我们的因果注定折散于十七岁长夜”,我或许就不会轻易提及离别。 	 #原创 #随笔 #情感 #文案 #文字的力量 #暗恋 #遗憾 #青春 #infj #infp,16069,情感故事,青春随笔
24,在青春期要见识一些真正宏伟壮丽的东西,初中有一年跟着家人旅游，路途睡在彻夜行驶的大巴上，半夜被暴雨惊醒。我趴在窗边的水幕舍不得眨眼的看，当时行在四周无人的旷野，两边飞快穿过树的黑影，只有接连从天上炸到底的灿烈的电光，一道道当真得照得像白昼那样，和惊彻磅礴的响雷，狂烈呼啸的风和摔打车窗的暴雨。我在其他人酣睡的沉默的车厢里看，还年轻，不懂这是什么感觉，只在无人回应的夜里感到一种眼眶发热的畅快。 	 #青春期 #生活,7905,情感故事,青春随笔
25,我以为我不会怀念那个夏天,我的青春如此普通，我的青春如此苦涩，我的青春啊，我为什么还是会怀念你#原创 #RED新生代创作大赛 #文字复兴单元 #回忆涌上心头 #怀念那年夏天 #那年的夏天 #怎么不怀念呢 #高中 #高中回忆录 #我以为忘了想念,33,情感故事,青春随笔
26,韩国文学温馨疗愈的句子…,首尔青坡洞有一家叫Always的便利店，它always商品短缺、always人手不足，被街坊邻居吐槽是“蕞不便利的便利店” 	 可就是这样一家“不便”的小店，却成了无数失意者的落脚地： 	 失忆流浪汉独孤，从流落街头到成为夜班店员，笨拙却真诚，用一碗热饭团、一杯玉米须茶，悄悄接住每个崩溃的人； 	 毕业即失业、焦虑到神经衰弱的“首漂”，在便利店的烟火气里，慢慢找回前行的勇气； 	 生意濒临倒闭、却固执不肯做外卖的烤肉店老板，在几句唠叨的开导中，解开了心结； 	 叛逆又孤独的高中生，在这里找到了逃离压抑家庭的小小角落，重拾对生活的热爱… 	 作者金浩然的笔触很细腻，喜欢看《请回答1988》或者《深夜食堂》的小宝们，建议你们去看这本《不便的便利店》！！ 	 ps：每次看到美食描写的时候我特别希望自己旁边有一份炸鸡🍗...书摘图片我放在下面！ 	 #infp #书摘 #金句 #文学 #韩国文学 #治愈 #情感共鸣 #阅读马拉松 #惊艳到你的句子 #我会被文字打动,692,情感故事,治愈文案
27,一些充满能量的句子3.0✨,最后，应该向前，继续向前 我期待这个春天。 #我被文字打动 #文字的力量 #句子分享 #自我成长 #高能量 #有力量的话 #磁场 #治愈 #infj,4784,情感故事,治愈文案
28,治愈系文案｜一些很温暖不内耗的文字,🌿生命如此短暂我们没有时间 去争吵、道歉、伤心、斤斤计较 我们只有时间去爱， 一切稍纵即逝 ——马克·吐温 🌿如果你赶不上凌晨五点的日出 不妨看看傍晚六点的夕阳 我的意思是任何时间都不晚 🌿人生没有幸福不幸福 只有知足和不知足。 无病无灾就是福泽，温饱无忧就是幸事。 至于其他， 有则锦上添花，无则依旧风华 赚钱的目的是为了更好的生活 而生活的目的不仅仅是赚钱。 不要和别人比生活，生活永远比不完。 🌿每个人都有属于自己的一片森林 也许我们从来不曾去过， 但它一直在那里，总会在那里。 迷失的人迷失了， 相逢的人会再相逢。 ——村上春树 🌿生为冰山， 就该淡淡地爱海流爱风 并且在偶然接触的时候 全心全意地爱另一块冰山。 ——王小波 🌿雨过天晴，终要好天气。 世间于我于万种欢喜， 沿途逐枝头怒放， 全部遗漏都不要紧 得你一枝配我胸襟就好 ——张嘉佳 🌿在岁月，我们走过了许多春夏秋冬； 在人生，我们走过了许多冷暖炎凉 我总相信，在更深更广处 我们一定要维持着美好的心 欣赏的心 就像是春天想到百合 秋天想到芒花 永远保持着预约的希望。 ——林清玄 🌿逝去的从容逝去， 重来的依旧重来 在沧桑的枝叶间， 择取一朵明媚，簪进岁月肌里， 许它疼痛又甜蜜。 ——汪曾祺 #经典摘抄 #文案 #句子 #温柔系治愈文字 #打动人心的句子 #令人惊艳的句子 #好句分享 #暖心句子分享 #治愈的文字 #分享好句,3054,情感故事,治愈文案
29,生命感 淡淡 文案,#生命与自然 #文案 #温柔系治愈文案 #infj的世界 #治愈文案 #忧郁感 #生命力 #分享文案 #文案分享,1994,情感故事,治愈文案
30,更大的世界会稀释痛苦，也会稀释爱。,原作者：@梁州 	 多年前的夏天，在大树下第一次听见蝉鸣时喜悦的时刻，已然是上个世纪的回望了。更大的世界会稀释痛苦，也会稀释爱。 	 #阅读 #女性成长 #分享 #明亮的夜晚#知识 #生命的意义在于感受 #那份具象的爱 #慢慢理解世界 #这个世界会好的 #爱我缓慢向上的勇气,24504,情感故事,治愈文案
31,一些幸福的meme🍀,我喜欢淡淡的生活 淡淡的情绪 淡淡的心情和简略的语言 就像雨滴落在地面没有任何痕迹 我喜欢这样平静的生活 淡淡的就会减少很多的痛苦 淡淡的就顺顺的 #韩语meme#幸福#幸运#分享图片#淡淡的幸福,1397,情感故事,治愈文案
32,我要稳稳的幸福,自存一些有生命力和幸福感的文案！！#我要稳稳的幸福 #做坚定的幸福主义者 #愿我们都能站在幸福里 #文案馆 #文案分享 #文案,10171,情感故事,治愈文案
33,就这样淡淡地记录 ㅇㅅㅇ/。,1.今天也是阴天。老天想不开的时候就会这样。 2.要么写 要么不写。我的意愿是写。 3.像玩文字游戏一样的 我的日记被我玩。 4.其实我这一生要做的事情只有三件：①好好休息 / ②好好学习 / ③好好体验。 5.但我擅长的事情：把简单的事变复杂。 6.更擅长的事情：对复杂的事情生气。 7.( ̀⌄ ́) （被气笑就会变成这样的人） 8.骗你的。我其实什么都不想做。但真的什么都不做的话我也会生气。一生气就会容易想哭。想哭就会泪如雨下。那我是什么？雨刮器吗？ 9.想祝你幸福很久。这句是真的。 10.凑十全十美来的。以上。 	 / ：#懒人日记  #文字  #随笔  #发疯文学  #一些有的没的,10741,情感故事,治愈文案
34,“天呐，好喜欢这段话”,要永远年轻，永远热情，永远不会听话，要大笑，要做梦，要与众不同，人生是一场伟大的冒险。 	 一个人可以想去哪里就去哪里，喜欢什么就吃什么，你的身心将重获自由， 你的时间和空间也都可以由你尽情支配， 你的幸福感会喷涌而出。 	 爱情是你自己的品质，是你自己的心魂，是你自己的处境，与别人无关。爱情不是一个名词，而是动词，永远的动词，无穷动。 	 我爱这悠长的旅途，可以从容地想你。 	 #分享好句 #文字也有力量 #好句分享#永远会被这段文字打动 #文字语录 #永远被文字打动的 #句子分享 #被文字治愈 #好句 #文字,1327,情感故事,治愈文案
35,加缪笔下清醒治愈的阳光哲学,加缪的哲思，如冬日的阳光，温暖治愈，又不失锋芒。 	 1. 对未来的真正慷慨，是把一切都献给现在。——《鼠疫》 	 2. 在寒冬，我学会了这个真理：当无力改变风向，就调整帆的角度。 ——《瑞典演讲》草稿 	 3. 爱不是寻找完美的人，而是学会用完整的眼光看有缺陷的人。 ——《堕落》 	 4.我并不期待人生可以过得很顺利，但我希望碰到人生难关的时候，自己可以是它的对手。——《加缪手记》 	 5.爱是没有界限的，如果我能拥抱一切，那拥抱得笨拙一点又有什么关系。——《置身于阳光与苦难之间》 	 6.真正的救赎，并不是厮杀后的胜利，而是能在苦难之中找到生的力量和心的安宁。——《加缪语录》 	 7.一个伟大的行动和思想，都有一个微不足道的开始。——《西西弗神话》 	 8.真正的坚韧不是不曾跌倒，而是在严寒中依然能唤醒内心的夏天。——《夏天集》 	 9.所谓清醒，就是亲手砸碎他人为你定制的生存剧本。——《局外人》 	 我是耕霖，很荣幸隔着屏幕认识远方的朋友。你被哪一句给治愈了呢？评论区来告诉我～ #读书摘抄 #经典文学名著 #美句摘抄 #我被文字打动句子 #自我成长 #自我提升 #自我认知 #治愈 #治愈自己 #经典语录,1110,情感故事,治愈文案
36,低谷期救赎文案 | 支撑你走过暗淡时刻✨,. 当身体扛不住的时候 意志会带你杀出重围 . 你已经跌到谷底了 接下来的每一步都是上坡路 . 如果没有天赋 那就一直重复 . 摸摸心跳 那就是最好的证明 所有未能摧毁你的 正在秘密锻造你 . 疼吗？疼就对了 这说明你还在感觉、还在活着 还在通往救赎的路上 . 风雨扑打你的窗 不是要摧毁你 是为了洗净玻璃 让你看清自己多像钻石 . 救赎不是突然的拯救 而是每天把自己 从深渊里拉出五厘米 重复三千次 . 隧道尽头一定有光 即使你此刻看不见出口 再走十步，再走十步 光就在那里等你 . 你摔落的坑洼里 后来都成了救人的台阶 今日的伤疤 是明日为他人的撑伞 . 不要一直责怪 过去的自己 他曾经站在雾里 也很迷茫 . 低谷不是终点 而是你重新校准 自己的坐标 大地最黑暗时 星星最清晰可见 	 #低谷期心态调整 #治愈低谷时期的你 #自我成长#低谷期 #救赎 #一句话陪我过难关  #支撑你走了很久的一句话 #分享 #人生道理#一句话的力量#女性成长 #励志文案 #短句文案 #暖心句子分享 #分享好句 #生活美学 #女性智慧 #此心安处 #短句,2329,情感故事,治愈文案
37,莫辜负茶 汤 好天气,/ 你花了整个童年学习如何蜷缩起来不碍事，如今需要花时间重新伸展四肢，去感受自己在天地间本应有的位置。世界不再是你记忆中的模样，而你也不再需要为存在本身道歉。 	 人生忽如寄，莫辜负茶、汤、好天气。 	 谨慎地拥有，珍惜地使用，勇敢地放弃。 	 在我有生之日，做一个真诚的人。不放弃对生活的热爱和执着，在有限的时空里过着无限广大的日子。 #手写 #摘抄 #文字 #文案 #排版小动物 #治愈拼贴 #波点控 #古早味 #我被文字打动 #4605_,29664,情感故事,治愈文案
38,每日文摘｜那些被夏天吻过的句子☀️,🌿夏季与我们的生命曾是同一种质地。 ——勒内·夏尔《愤怒与神秘》 	 🌿未来像盛夏的大雨，在我们还不及撑开伞时就扑面而来。 ——刘慈欣《三体》 	 🌿我是否可以把你比喻成夏天？虽然你比夏天更可爱更温和。 ——威廉·莎士比亚《十四行诗》 	 🌿在六月初，草木的世界骤然迸发，每一个日落都独一无二。 ——约翰·斯坦贝克《我们不满的冬天》 	 🌿短暂夏夜烧化了，绿谷中升起湿气，千百树木的汁液在沸腾。 ——赫尔曼·黑塞《克林索尔的最后夏天》 	 🌿不但春妍夏亦佳，随缘花草是生涯。 ——杨万里《夏日绝句》 	 🌿我只需咬开一颗草莓的紧实，就能看见夏天——它的尘埃与低垂的天空。 ——托妮·莫里森《最蓝的眼睛》 	 #生活在诗中流淌 #每日文摘 #小红书年度诗篇 #句子控 #属于夏天的诗 #浪漫生活的记录者 #每日书摘 #素材 #惊艳到你的句子 #分享好句,1442,情感故事,治愈文案
39,我们只是跋涉，不用琢磨太多,可不可以有一些时刻，我们就在一片空旷中闲坐，不谈具体，无所谓现实的任何，清晰的东西太多了，转瞬即逝反而像一种把握，你在想什么？想我们只是跋涉，深一脚浅一脚，呼吸错落，从前和以后都不复存在，看见我吧，也关心我，不用琢磨太多,10930,情感故事,治愈文案
40,李娟真的太会写了，这段看得我泪流满面😭,我不得安宁。 无论生活在多么偏远僻静的地方， 我的心都不得安宁。 我最嘈杂，最贪婪。 我与眼下这世界格格不入。 眼下世界里，青草顶天而生， 爬虫昼追日，夜逐月。 风是透明的河流，雨是冰凉的流星。 只有我最简陋，最局促。 我酝酿出一份巨大的悲哀， 却流不出几行眼泪。 我全面坦露自己的软弱， 捶胸顿足，小丑般无理取闹。 可万物充耳不闻。 我无数遍讲诉自己的孤独， 又讲诉千万人的万种孤独。 越讲越尴尬，独自站在地球上，无法收场。 ——李娟《遥远的向日葵地》 #读书 #情感 #孤独 #美文#文学 #书籍#李娟 #治愈书单 #好句摘抄分享 #遥远的向日葵地#我被文字感动了 #文学的力量 #infj #治愈系散文,20908,情感故事,治愈文案
