post_id,title,content,like_count,category,keyword
1,雨季不再来 - 小红书,没有任何词句能比“雨季不再来”更好的形容我每次回顾青春往事时的心情。 	 生命中曾奉为圭臬的沉默、不能开解的结、和自以为天长地久的隐痛居然都随着雨季的结束消失殆尽。曾折磨我不得安睡的理想和恐惧如今成了我生命中平静的湖泊。我依旧追寻它们，却不再迷恋。 	 在偶尔的书写和表达以及更长时间的沉默中，会梦见高中时的人和事。我最想逃离的自己，你如今过得还好吗？ 	 原来一切就像我曾写过的那样，在没有生长痛的夜晚，人才能品味到青春的回甘。 —— 亲爱的echo，感谢你写下《雨季不再来》 	 #随笔 #原创随笔 #我会被文字打动 #青春 #girlstalk #爱是 #三毛 #icity #漫长的雨季 #回忆,7077,情感故事,青春随笔
2,“二十几岁的生命底色是混乱与懵懂” - 小红书,我始终不认为，二十几岁是人生的黄金时代。它像是一场突如其来的旋风，带着混乱和痛苦劈头盖脸地冲向每个渴望简单幸福的年轻人。生命底色在熔炉中被重塑，伤痕刻在灵hun深处，变成了只有自己能读懂的语言。 - 到二十几岁，我才不得不承认，这段生命的颜色充满混沌与绞痛。我不会明白何为伤痕，何为焚烧殆尽后的自我只能靠暗号慰藉。我不会懂得成年人如何在一次又一次溺水般的经历中试图靠岸，zui终却不得不承认，岸不一定存在。又或许，岸并不是我们想象中的那个样子。 #原来我们就是青春 #治愈 #成长 #随笔 #迷茫与成长 #小红书原创随笔 #永远会被这段文字打动 #行走二十岁 #情感 #约稿展示  @小红书创作助手 @热点薯 @校园薯,4859,情感故事,青春随笔
3,只是那时，歇斯底里的声音覆盖住了意义 - 小红书,只是那时，歇斯底里的声音覆盖住了意义。 	 学生时代是喧豗而轰然的。响了很久的上课铃在老师的谩骂声中渐渐消失，我们只能用笔尖反复摩挲着纸面来转移注意力。苦口婆心的教诲听了无数遍，却还是选择在大道理面前沉默，陷入无边的题海。 	 晚自习时，各个班级里的英语听力交错播放。教室里的灯光明晃晃的，与窗外的夜幕截然不同。车水马龙在耳边萦回，鸣笛声不断，成为一种属于晚自习的背景音。每每此刻，我总是会在心里默默想着：可不可以，把我，连同我的梦想一起带走？ 	 白昼里那些被埋藏的情绪，被淹没的委屈，在此刻也纷纷复活。我们开始在心里喋喋不休，有些话欲言又止，化为眼泪掉落。 	 但那是自由也有迹可循。夜阑人静时，走廊里依旧人满为患，昏黄的灯光将梦想的影子拖得好长好长。我们总是高谈阔论着，未来与以后，岁月与流年，总觉得多年后听起来也像是弹指之间。 却忘了，此时此刻，愿景与如今重叠的瞬间，才是最伟大的永远。 	 我们歇斯底里，总在故事的最后，才明白苦海的波澜起伏。 	 #Icelume #文字 #随笔 #我们永远在这里 #学生时代 #青春 #爱 #苦海 #学海无涯苦作舟 #那时的我们不懂永远,476,情感故事,青春随笔
4,喜欢少年。 - 小红书,喜欢情义与朦胧的爱诞生在少年时期，不知天高底厚，纯粹青涩的如纽扣一般紧紧扣着。未经世俗，骨头连着皮肉也正值青春。她们偶尔肆意妄为，蹬着单车追风的步伐，臂弯里夹本杂志漫画，看什么不爽就嚷嚷着要扁谁。后坐的吃了一嘴风，发丝撇到脸庞。少年们的叫喊就像山的起伏，起起落落。跟本不齐，也不着调。让一切去死吧，不知谁说的，也不在乎谁说的。思绪过去了，你我靠在一起，脊背的骨头仿佛在这一刻蓬勃生长了起来。嘴里说着未来，现在和过去。少年啊，就是一盏“有气”的亮灯，一盏会熄灭的灯。到油尽干枯的时候，她会走马灯花地回想那梦幻的一幕吗？ 	 #随笔 #原创随笔 #日常随笔 #原创文字,168,情感故事,青春随笔
5,人类最不擅长的事是说再见 - 小红书,人类最不擅长的事是说再见。 	 “再见”这个字真的好神奇。它太轻了，像是从口齿之间轻飘飘地叹出来的，飞到未知的远方。它又太重了，落在似水年华里，像一滴积攒已久的泪珠坠落到轻薄的纸上，晕开的是我们的百感交集。又像是重若千钧的陨石毫无征兆地降落在土地上，留下难以填平的沟壑。 	 “再见”说出口时，周围的空气仿佛都染上了悲情的色彩。我感受到，江海在吐纳，世界在叹息，宇宙在无情地吸吮着时间。 	 我想，再见这个词，大抵也有很悠久的历史吧。它囊括了太多太多，跨越了王朝的更迭和四季的变迁，从光年之外走向我们眼前，见证着我们从一开始的犹豫不决到后来的落子无悔。 	 毕业典礼那天，很多事情被带上了“最后一次”的前缀。最后一张合照，最后一次拥抱，最后一次和你说再见，最正式、最有温度的再见。我看着你眼睛里的我自己变得越来越小，看着你的背影，默默地说出了道别的话语。 随后迎来的，是泪眼婆娑。 	 “再见”这个词，早已穿透了我们生命的涟漪，穿梭在跌宕起伏之间。 	 我们该说再见，还是再也不见呢？ 	 #文字 #随笔 #我们还会再见的 #人总要离别 #Icelume #爱 #青春 #再见 #离别 #所以说永远多长,5141,情感故事,青春随笔
6,《苦橙子》｜致每个女孩失声的青春期 - 小红书,“当语言失效时，身体便开始尖叫” 这篇文字写起来很痛苦，但我希望大家都能自己治愈自己，咽下苦橙子，用声音代替咳嗽， 让那些“未发出的声音”都可以被听到#原创随笔 #原创短篇小说#青春期 #谁的青春不迷茫  #girltalk #软柿子疯起来,4617,情感故事,青春随笔
7,我抓住青春这枚鱼脊的尾梢。 - 小红书,冷鲜奶与青提味道的啫喱，我们初遇的夏季，爬过森绿色的天梯再淋雨跑到火车站，同汽水一般酸的冰荔枝终于也消弭在了饱和着迪斯科的一九九九。我载着橙红年代的太阳，手腕上那截鱼脊链磨得比珍珠还白，明晃晃地将爱情的淤青掩藏。张**跟我躺床上的时候就喜欢抓住这里，要咯得我挤出血痕，要直至教会我喊爱为止。他说我看着情歌也能三押、风流倜傥的，骂起人来流利，讲起爱来却舌头打结，问我是不是存心针对他。 	 冤枉吧我当然没有。随后我们就都缄默了，活脱脱一副淡如水的样子在黑夜里凝视着对方，任凭summer time这段青稚以灼烫来舔舐我们。 	 漂泊在海湾的人总会不可避免地彻夜忖思起三个问题：幸福、爱与以后。怎么定义幸福。什么叫做爱。以后又如何。将生命喻作漫长的旅途时，我们或许并未预设下问题的答案，以至于这就成了一门哲学，而我们将花费永远去探讨。又说到“永远”，永远是青春期里的高频词。Never，我们通常是这样解释它的。 	 #文稿 #随笔 #原创 #小红书年度诗篇,358,情感故事,青春随笔
8,“祝我们仍有勇气做各自命运的句点” - 小红书,我当然知道我们还会在此后的二十多岁中淋雨、痛哭、失眠，或许将一个人行色匆匆跋涉过风雪天，孤身在外的时刻也想过故乡的云会不会和我漂泊得同样遥远。但还好一路晦明更迭，庸碌诗行里我们仍有勇气做各自命运的句点，仍然愿意从明天起喂马、劈柴、周游世界，在穿过迷茫与失意后还将去再爱一遍人间。 	 #原创 #随笔 #情感 #文字 #成长 #祝福 #我会被文字打动 #青春 #infj #infp,7600,情感故事,青春随笔
9,我的青春大约是一场太阳雨。明明艳阳还在天上挂着，光却已变得潮湿，一粒粒雨丝砸在皮肤上，又热又凉。 	 风挟着水汽包裹全身，我看见雨珠在阳光中穿过，亮晶晶的，像无数短暂的流星，跌碎了，在水泥地上洇开深色的痕。有人在笑，笑声撞在雨线上，碎成更细的沫，飞走了。 	 过去总以为痛楚是件惊天动地的事，必要电闪雷鸣。后来才懂，最深的怅惘原是这般晴光潋滟的好天气里，无端落下的一阵雨。分明周身都被照得透亮，发梢却坠着水珠，擦不干，抹不尽。一抬头，日光刺目，只好又低下头去。 	 我们都行在这样一场雨里，衣裳半湿，在明亮的雨丝中辨认彼此湿润的轮廓。想说的话被雨声盖过，只剩下模糊的口型和一双双被水光洗得异常清亮的眼睛。 	 雨忽然就停了。水洼里倒映着重新变得干燥的天空，亮得晃眼。只有树下偶尔摇落的一两滴冷水，顺着脖颈滑进衣领，叫人蓦地一惊，想起方才那一场太阳雨是真的来过。 	 而青春已像地上一汪一汪的光，蒸发得无声无息。 #青春是一本仓促的书 #青春疼痛文学 #文字是终身热爱 #抽象 #深夜emo - 小红书,我的青春大约是一场太阳雨。明明艳阳还在天上挂着，光却已变得潮湿，一粒粒雨丝砸在皮肤上，又热又凉。 	 风挟着水汽包裹全身，我看见雨珠在阳光中穿过，亮晶晶的，像无数短暂的流星，跌碎了，在水泥地上洇开深色的痕。有人在笑，笑声撞在雨线上，碎成更细的沫，飞走了。 	 过去总以为痛楚是件惊天动地的事，必要电闪雷鸣。后来才懂，最深的怅惘原是这般晴光潋滟的好天气里，无端落下的一阵雨。分明周身都被照得透亮，发梢却坠着水珠，擦不干，抹不尽。一抬头，日光刺目，只好又低下头去。 	 我们都行在这样一场雨里，衣裳半湿，在明亮的雨丝中辨认彼此湿润的轮廓。想说的话被雨声盖过，只剩下模糊的口型和一双双被水光洗得异常清亮的眼睛。 	 雨忽然就停了。水洼里倒映着重新变得干燥的天空，亮得晃眼。只有树下偶尔摇落的一两滴冷水，顺着脖颈滑进衣领，叫人蓦地一惊，想起方才那一场太阳雨是真的来过。 	 而青春已像地上一汪一汪的光，蒸发得无声无息。 #青春是一本仓促的书 #青春疼痛文学 #文字是终身热爱 #抽象 #深夜emo,593,情感故事,青春随笔
10,天地霏雨  人与人 藕断丝连 - 小红书,#文字 #随笔 #原创 #情感共鸣 #inmyfeelings #fyp #青春 #intp#情感树洞,200,情感故事,青春随笔
11,然夏天仍是夏天 - 小红书,青春十纪的故事似乎总聚焦于具体的夏天，朦胧又清晰。夏天是自由蓬勃，像被人抱着转圈一样热烈，生命力疯长。夏天是漫出泡沫的啤酒，是吹来满足的海风，是散步偶遇的浪漫，当然耳机里还得放着summertime的live版。 	 我浸泡在初夏，却对将至的热夏没有半点期待。我对夏天最真实的记忆是无尽的雨季，深蓝色气旋压得人喘不过气来。柏油马路的沥青味，潮湿的霉味，阴沟反臭，人海中的肉夹气，恐怕五点早起的小鸟闻了都想吐，蚊子闻了都吸不动血。或许因为在深冬出生，夏天总让我感到烦闷，粘稠，难以扎根。流不完的汗与泪，意识被烈阳晒成空白，想法在炽热中收窄。我像闯入家中的蜜蜂，一次次撞在生硬的玻璃上，窗户似铁丝网般将我包围。而且似乎夏天一过我就得长大，然而夏天难以走出，死结未解，新生未临，在一双双眼睛下，艰涩又尴尬。 	 三岛说，“夏天”这个词本身就使人联想到“死”和“糜烂”。晚夏明丽的霞光，也含着糜烂的火红。我只奢求在这样的季节能活得流利一点，能躲在凌霄花后，永远“不要被命运找到”。 #文字 #感想 #热门 #夏天 #讨厌夏天,1949,情感故事,青春随笔
12,我会亲自洞穿你沉重的青春 - 小红书,#随笔 #文字 #感受 #关于我的墓志铭 #但在死亡之前 #如果还能见到你 #还想和你谈论宇宙和天空 #话虽如此 #希望大家得偿所愿一切顺利,170,情感故事,青春随笔
13,韩国SNS | 与暗恋告别少女 - 小红书,#韩国SNS #初恋回忆 #青春遗憾 #暗恋日记 #错过的人 #情感独白 #青涩爱情 #学生时代的恋爱,4105,情感故事,青春随笔
14,“夏天适合畅想明亮” - 小红书,我们不要辜负长夏，不要辜负白昼和晴天。 	 #随笔 #夏天 #成长 #高校诗歌创作联盟 #信件 #肆意地感受夏夭 #友谊地久天长,360,情感故事,青春随笔
15,我不再畏惧命运了 - 小红书,我见过最虔诚的心，在每双被命运淋漓过雨季的眼中 	 年轻的游子总以泪水为刻度编年撰史，为博取命运一次恻隐反复践行，学习以尚且单薄莽撞的勇气驯服这场沉重预言。 	 可是命运，天地之大，你想要我漂泊至何处？ 	 我曾经天南海北的去顿悟，惊天动地的去追逐，做天真的棋子，做蒙尘的明珠，在岿然而漫长的劫难中惘然自处，遥遥等待一场天赐的福咒；我曾经流逝，眼见一颗菲薄的心在你无声默视中消弭殆尽，变成蛰伏在身体深处一枚图腾；我曾经以为你慷慨辽阔，只要身处其中，不必立经幡也闻祝福，不必拜庙宇也受庇佑。直至血流如注，长泪不止，才惊觉与你相较，我不过是五百年前，烟消云散之后一枚愚昧顽石。 	 命运教我一身孑然，疼痛欲绝，教我固执的生与死，忧患亘久蛰伏，这许许多多的失落与交付，漂泊无岸的尽头，终于懂得所有断裂是为了生长，所有远行是为了回望。 	 从此我不再畏惧命运了，我相信所有的雨季都是为了回到最初的洋流。 #文学 #文字 #命运的子弹正中眉心 #原创 #随笔 #约稿 #命运 #infp #情感树洞 #时过境迁物是人非,7246,情感故事,青春随笔
16,那是我记忆的蒙太奇 - 小红书,我生命的厚度还不足以赋予我连贯的意象。 即便是最恳切的情绪，盛到纸张上好像也会只剩几行句子的热度。一切都在象征性地弥散，关于往日的印象，那些交叠的手掌、那些恬静的拥抱、那些能由一段简单旋律牵引出的后知后觉，像燃烧的意象被海浪击碎。 即使在夏天，我口中仍然呼着短促的雾气，那是我记忆的蒙太奇。 #文字 #随笔 #原创 #碎碎念 #我会被文字打动 #记忆 #生命中的夏天 #总会消逝 #生命的厚度 #单薄如纸,5480,情感故事,青春随笔
17,期末复习总让人有灵感 - 小红书,复习的时候，打游戏，会心慌，放下手柄，觉得时光虚度。但写东西不会，像是回到高中晚自习对着草稿纸发呆的时候，特别满足。 #随笔 #期末复习#记录#bg#薄荷,5404,情感故事,青春随笔
18,“与珍贵的人一起澎湃。” - 小红书,付出爱是我的本能，我喜欢为在意的人事激发所有感官，我的眼泪是滚烫的熔岩，我的心疼是冲破屏幕的安抚，我的笑容是因为幸福。我依然拥有敢于不顾一切的能力，哪怕结局是悬崖，我也没想过回头。 因为我知道，全身心爱上什么是人生太难做到的事情，此刻我的生命与你们有关，我不要无味地来去，我要斩钉截铁地留下痕迹。 #我被文字打动 #infj #文案 #原创 #情感 #随笔 #追星 #青春 #cp #爱自己,4353,情感故事,青春随笔
19,“趁夏日未完结 趁我们还深信不疑明天” - 小红书,像行过雨水满溢的节气却只持一柄单薄旧伞，过往的刻痕遗留下湿漉漉的脉络，拂不尽的水汽如同年复一年困住我的嶙峋山峦。 我依旧被反复困在那座山。 	 #原创 #随笔 #情感 #文案 #文字的力量 #青春 #遗憾 #毕业 #浪漫生活的记录者 #infj,1095,情感故事,青春随笔
20,我从何时开始爱你 - 小红书,去谈论开始喜欢一个人时间是件很困难的事情。 从这端遥遥地望向开始那端，一种近视的模糊，本能的话语缺失。很难找到开始的那个的端点，汹涌的爱意来临之前也不会有任何体感上的征兆，蚂蚁不会在马路上搬家。 所谓喜欢，更像是在乌鸦喝水，每一个心动的时刻是一颗石子，一颗一颗投进去。当水位终于上升到满溢，水流顺着杯壁作流泪状汩汩留下，才心下轰然，觉察那是爱。 	 #文字 #我被文字打动 #爱情 #暗恋 #爱永远是突然降临的 #原创,7712,情感故事,青春随笔
21,春天被你目光的温度灼烧，在我们怀抱中凋零 - 小红书,融化的春天，源自于我们的炽热。 #文案 #原创 #青春 #随笔 #情感 #高校诗歌创作联盟 #小红书年度诗篇 #暗恋 #淮蕣文学社 #越星水文学社,8,情感故事,青春随笔
22,感觉帖主说的14岁不一定真的指14岁，它可以是15岁16岁甚至20岁21岁，可以是人生任何一个阶段的夏日——只要这个夏日足够美好，只要陪在身边的人或者你本人甚至那段日子足够耀眼，那么日后每一个夏日都会开始怀念，但转念一想，当下我们也能创造一个新的值得怀念的夏日。人生尚未迟暮，万事皆为序章 #即使我们成为大人 #年少时的我们 #日常随笔 #青春里的遗憾 #原创随笔 #遗憾的青春 #原创文章 #小红书原创随笔 #学生时代的暗恋 #随笔 - 小红书,感觉帖主说的14岁不一定真的指14岁，它可以是15岁16岁甚至20岁21岁，可以是人生任何一个阶段的夏日——只要这个夏日足够美好，只要陪在身边的人或者你本人甚至那段日子足够耀眼，那么日后每一个夏日都会开始怀念，但转念一想，当下我们也能创造一个新的值得怀念的夏日。人生尚未迟暮，万事皆为序章 #即使我们成为大人 #年少时的我们 #日常随笔 #青春里的遗憾 #原创随笔 #遗憾的青春 #原创文章 #小红书原创随笔 #学生时代的暗恋 #随笔,28,情感故事,青春随笔
23,我们无法预知某一瞬间的价值直到它成为回忆 - 小红书,"- 	 看了余华的节目，他谈到青春，真是让我又哭又笑。 	 在余华看来，人的记忆是有选择性的，青春也是可以自己定义的，只要让你愿意记住的，就是青春的起点。 	 他心里的青春，从27岁发表小说开始。27岁以前天天给人拔牙的那段人生他无法称之为""青春""。年轻时他也曾怀揣成为歌唱家的梦想，每天凌晨到海边练声，反倒被村里人误以为山中闹👻，只得狼狈放弃。 	 可他说，正是那些不切实际的梦想，才让青春显得生机勃勃。倘若每个梦想都很实际，那就不叫梦想了。 	 余华也有青春的遗憾。有次搬家时嫌书信麻烦，烧掉了一大箱的信件，其中有十多封史铁生的信。那部分珍贵的记忆没有了，这长久的懊悔，成了他回忆里特殊的一段。 	 - 	 关于青春，40岁的仁科认为，此时此刻便是一个人的青春；精 选 创作者特厨隋坡坦言，自己没有上过高中，十八岁误打误撞进入后厨，选择在烟火炉灶里开启了人生篇章。 	 他们的青春都没有被年龄所框住。 	 所以《一个文学的午后》让我想明白了：不必纠结年少碌碌无为，也不用困在过往的缺憾里内耗。我们可以筛选记忆，和灰暗的过往和解、放下糟糕的从前。 	 人生没有迟到的青春，每一个奔赴热爱的当下，都能成为青春崭新的起点。 	 #余华 #一个文学的午后 #青春 #青春回忆 #人生感悟 #文字的力量 #2026高考季 #高考前最后叮嘱",163,情感故事,青春随笔
24,我以为我不会怀念那个夏天 - 小红书,我的青春如此普通，我的青春如此苦涩，我的青春啊，我为什么还是会怀念你#原创 #RED新生代创作大赛 #文字复兴单元 #回忆涌上心头 #怀念那年夏天 #那年的夏天 #怎么不怀念呢 #高中 #高中回忆录 #我以为忘了想念,33,情感故事,青春随笔
25,“成长是偷走夏天的小偷” - 小红书,我也以为夏天会慢慢变好的，树木会更葱郁，阳光会更干净，风声和雨声清晰又动听，直到岁月从我眼前奔走而过，年少时亲手设计构筑的夏天彻底崩塌，烟尘四起。我没有呜咽，没有嚎啕，也没有歇斯底里。直至此刻，我已经变得平静、柔顺，也终于确信：成长是偷走夏天的小偷，所有盛大的幻想终究是难以敌过时间和现实的刀刃。 	 时间从十八岁碾过、撕扯过，留下了很多细密的疼。夏天是闷热的、潮湿的，蝉鸣是吵嚷的，我停止了一切幻想，接受了夏天只是夏天的真相。 	 夏天，只是一个季节。 	 #夏天 #成长 #遗憾,2315,情感故事,青春随笔
26,“我的青春是朴素的” - 小红书,#云序言 #淼嘉恋专属话题 #随笔 #青春是一本仓促的书 #这就是青春 #那是我再也回不去的青春 #青春是那么美好 #我的青春落幕了 #青春是一场盛夏 #我的青春回头看了我一眼,21811,情感故事,青春随笔
27,在那个渗透你的气息的季节。 - 小红书,在那个渗透你的气息的季节，​淡蓝的衬衫被附着上桃子的香气。 ​那个夏天很短暂，但似乎又是漫长的，因为白天夜里无时无刻不弥漫着你的气息。 ​我们在那个淡黄的沙滩，蒸发着情感，交融着爱意。蓝白相间的条纹短袖，延伸出你均匀年轻的双臂，多么可爱，多么单薄，像母亲赠予妹妹的陶瓷娃娃，我渴望轻轻触摸，或画上海的样子。 那时什么都包围着你，阳光，海浪抑或是我，那时我只看着你，我的一切都从你那里得到。 我们用青铜交织着古铜色的雕塑手臂，在海浪拍打着那片沙地时，在笑看彼此时，握手言和，不知道你的手上，是否会粘上锈迹。 ​我们在草地上铺散开，绿草从你的脖颈间生长出来，你会有青草的味道，会有阳光的温暖。它们和着微风淅淅沥沥的掠过你的脸颊，踏过你的双眸，你像个顽童一样，在我身上蹭来蹭去。我闻着你袖口的味道，我听到你在呼唤我的名字。 在树荫下葱郁的你，如杏树结果般的你，跳入泳池就化成水的你，变成无数条鱼儿的你，我爱这样全部的你。 在那个夏天的夜晚，我们一起蔓延，一起绵长地溺毙在这彼此的温柔中。 我只想紧紧拥抱着你，让我不可豁免的爱全都给予你，即使是我多年后全部的泪水，也要为你化为一条河，再看看你的清澈，再容容你的泪水，也许可以用你的名字来命名。也许可以，以你的名字来呼唤我。 这样如此的你。#生活美学 #随笔 #原创随笔 #文字 #infp #请以你的名字呼唤我 #同人文 #文字 #人生流淌在诗歌里 #夏天,174,情感故事,青春随笔
28,“我们的被子再也晒不出二十岁的味道了” - 小红书,那时候不懂什么叫无忧无虑，只知道中午趴在被子上睡一觉，第二天的数学课就不那么难熬。 眼睛闭上，鼻尖蹭到被子，扑面而来的就是那种干净又温柔的味道：阳光、洗衣粉、风吹了一上午的尘土，还有不知道从哪里飘来的梧桐叶气味。 你说不清它是什么，只知道那是“安心”的味道。 	 我们真正怀念的，是那段被阳光认真对待的日子。 而现在轮到我们自己，去认真对待，眼前仍在继续的生活。 #治愈 #成长 #情感 #原创随笔 #随笔 #校园 #只道当时是寻常 #原来我们就是青春 #文字控,161,情感故事,青春随笔
29,“如果我们的因果注定折散于十七岁长夜” - 小红书,我或许就不会轻易提及离别。 	 #原创 #随笔 #情感 #文案 #文字的力量 #暗恋 #遗憾 #青春 #infj #infp,16068,情感故事,青春随笔
30,現在妳是💧 - 小红书,存一則給之前的朋友寫的一本字書 	 佩服自己创作这些文字的时候实在是艰难但也还是整合了出来。以前自己真的是一个很喜欢记录很爱表达自己的人 雖然很爱哭会把自己的情绪表达发泄出来。 上高三我几乎每天都能输出好多文字，现在一切变得轻盈自由却忘了当时的自己是如何写下那般深刻的文字的。是因为太幸福了吗… 现在的我拥有一种重新感知这个世界的错觉。 #inmyfeelings #文字 #拾柒,150,情感故事,青春随笔
